{
  "schema": "humanoid-sockets-v2",
  "character": "humanoid.ranger.male",
  "unit": "meter",
  "axes": "right-handed-y-up",
  "sockets": [
    {"id": "hand_r.weapon", "joint": "hand_r",
     "translation": [-0.0365, 0.0839, -0.0043], "rotation": [0.415728, 0.576917, 0.446029, 0.543503],
     "attachFrame": "grip", "accepts": ["one-hand-weapon"], "mirror": "hand_l.weapon"},
    {"id": "hand_l.shield", "joint": "hand_l",
     "translation": [0.0365, 0.0839, -0.0043], "rotation": [0.415728, -0.576917, -0.446029, 0.543503],
     "attachFrame": "grip", "accepts": ["shield", "book"], "mirror": "hand_r.shield"},
    {"id": "hand_l.weapon", "joint": "hand_l",
     "translation": [0.0365, 0.0839, -0.0043], "rotation": [0.415728, -0.576917, -0.446029, 0.543503],
     "attachFrame": "grip", "accepts": ["one-hand-weapon"], "mirror": "hand_r.weapon"},
    {"id": "hand_r.shield", "joint": "hand_r",
     "translation": [-0.0365, 0.0839, -0.0043], "rotation": [0.415728, 0.576917, 0.446029, 0.543503],
     "attachFrame": "grip", "accepts": ["shield", "book"], "mirror": "hand_l.shield"},
    {"id": "back.stowed", "joint": "spine_03",
     "translation": [0, -0.061607, -0.226519], "rotation": [0, 0.993595, 0.113001, 0],
     "attachFrame": "grip", "accepts": ["shield"]},
    {"id": "hip_l.stowed", "joint": "pelvis",
     "translation": [0.175, 0.142748, 0.127956], "rotation": [-0.667907, 0.090365, -0.701309, 0.232164],
     "attachFrame": "grip", "accepts": ["one-hand-weapon"]},
    {"id": "hand_l.bow", "joint": "hand_l",
     "translation": [0.0365, 0.0839, -0.0043], "rotation": [0.021426, 0.792256, 0.609354, 0.023628],
     "attachFrame": "grip", "accepts": ["bow"]},
    {"id": "hand_r.arrow", "joint": "hand_r",
     "translation": [-0.0365, 0.0839, -0.0043], "rotation": [-0.09035, 0.092552, 0.723332, 0.678279],
     "attachFrame": "grip", "accepts": ["arrow"]},
    {"id": "back.quiver", "joint": "spine_03",
     "translation": [-0.07, 0.0403, -0.2236], "rotation": [-0.16647, 0.97955, 0.111403, 0.018933],
     "attachFrame": "grip", "accepts": ["quiver"]},
    {"id": "back.bow.stowed", "joint": "spine_03",
     "translation": [0.02, -0.0197, -0.3195], "rotation": [-0.314202, -0.942607, -0.107202, 0.035734],
     "attachFrame": "grip", "accepts": ["bow"]},
    {"id": "head.hair", "joint": "Head",
     "translation": [0, -1.5986, 0.0637], "rotation": [-0.014485, 0, 0, 0.999895],
     "attachFrame": "grip", "accepts": ["hair"]},
    {"id": "head.armor", "joint": "Head",
     "translation": [0, -1.5986, 0.0637], "rotation": [-0.014485, 0, 0, 0.999895],
     "attachFrame": "grip", "accepts": ["armor"]},
    {"id": "spine_03.armor", "joint": "spine_03",
     "translation": [0, -1.2759, -0.3011], "rotation": [0.113001, 0, 0, 0.993595],
     "attachFrame": "grip", "accepts": ["armor"]},
    {"id": "pelvis.armor", "joint": "pelvis",
     "translation": [0, -0.8985, 0.3087], "rotation": [-0.142364, 0, 0, 0.989814],
     "attachFrame": "grip", "accepts": ["armor"]},
    {"id": "clavicle_l.armor", "joint": "clavicle_l",
     "translation": [-0.0445, -0.0104, -1.4953], "rotation": [0.608561, 0.360303, 0.360546, 0.608146],
     "attachFrame": "grip", "accepts": ["armor"]},
    {"id": "clavicle_r.armor", "joint": "clavicle_r",
     "translation": [0.0445, -0.0104, -1.4953], "rotation": [0.608561, -0.360303, -0.360546, 0.608146],
     "attachFrame": "grip", "accepts": ["armor"]},
    {"id": "upperarm_l.armor", "joint": "upperarm_l",
     "translation": [1.4555, -0.1938, 0.0594], "rotation": [0.010731, -0.010672, 0.707025, 0.707026],
     "attachFrame": "grip", "accepts": ["armor"]},
    {"id": "upperarm_r.armor", "joint": "upperarm_r",
     "translation": [-1.4555, -0.1938, 0.0594], "rotation": [0.010731, 0.010672, -0.707025, 0.707026],
     "attachFrame": "grip", "accepts": ["armor"]},
    {"id": "lowerarm_l.armor", "joint": "lowerarm_l",
     "translation": [1.4555, -0.4404, 0.087], "rotation": [-0.011178, 0.011177, 0.707018, 0.707018],
     "attachFrame": "grip", "accepts": ["armor"]},
    {"id": "lowerarm_r.armor", "joint": "lowerarm_r",
     "translation": [-1.4555, -0.4404, 0.087], "rotation": [-0.011179, -0.011177, -0.707018, 0.707018],
     "attachFrame": "grip", "accepts": ["armor"]},
    {"id": "hand_l.armor", "joint": "hand_l",
     "translation": [1.4555, -0.6832, 0.0654], "rotation": [0, 0, 0.707107, 0.707107],
     "attachFrame": "grip", "accepts": ["armor"]},
    {"id": "hand_r.armor", "joint": "hand_r",
     "translation": [-1.4555, -0.6832, 0.0654], "rotation": [0, 0, -0.707107, 0.707107],
     "attachFrame": "grip", "accepts": ["armor"]},
    {"id": "thigh_l.armor", "joint": "thigh_l",
     "translation": [-0.0906, 0.9712, -0.0362], "rotation": [1, 0, 0, 0.000117],
     "attachFrame": "grip", "accepts": ["armor"]},
    {"id": "thigh_r.armor", "joint": "thigh_r",
     "translation": [0.0906, 0.9712, -0.0362], "rotation": [1, 0, 0, 0.000117],
     "attachFrame": "grip", "accepts": ["armor"]},
    {"id": "calf_l.armor", "joint": "calf_l",
     "translation": [-0.0906, 0.5349, -0.0966], "rotation": [0.998425, 0, 0, 0.056106],
     "attachFrame": "grip", "accepts": ["armor"]},
    {"id": "calf_r.armor", "joint": "calf_r",
     "translation": [0.0906, 0.5349, -0.0966], "rotation": [0.998425, 0, 0, 0.056106],
     "attachFrame": "grip", "accepts": ["armor"]},
    {"id": "foot_l.armor", "joint": "foot_l",
     "translation": [-0.0906, 0.117, 0.0381], "rotation": [-0.850946, 0, 0, 0.525253],
     "attachFrame": "grip", "accepts": ["armor"]},
    {"id": "foot_r.armor", "joint": "foot_r",
     "translation": [0.0906, 0.117, 0.0381], "rotation": [-0.850946, 0, 0, 0.525253],
     "attachFrame": "grip", "accepts": ["armor"]},
    {"id": "hand_r.staff", "joint": "hand_r",
     "translation": [-0.0365, 0.0839, -0.0043], "rotation": [0.68443, 0.296967, 0.652274, 0.133809],
     "attachFrame": "grip", "accepts": ["staff"], "mirror": "hand_l.staff"},
    {"id": "hand_l.staff", "joint": "hand_l",
     "translation": [0.0365, 0.0839, -0.0043], "rotation": [0.68443, -0.296967, -0.652274, 0.133809],
     "attachFrame": "grip", "accepts": ["staff"], "mirror": "hand_r.staff"}
  ]
}
